{
  "version": 2,
  "revision": 0,
  "document": {
    "nodes": {
      "n1": {
        "kind": "text",
        "icon": "",
        "label": "Text",
        "x": 180,
        "y": 140,
        "width": 120,
        "height": 28,
        "locked":false,
        "parent": null,
        "dag_rank": null,
        "tags": [],
        "metadata": {},
        "z_index": 1000,
        "style": "box"
      },
      "n2": {
        "kind": "text",
        "icon": "",
        "label": "Text",
        "x": 420,
        "y": 260,
        "width": 120,
        "height": 28,
        "locked":false,
        "parent": null,
        "dag_rank": null,
        "tags": [],
        "metadata": {},
        "z_index": 1000,
        "style": "box"
      },
      "sg1": {
        "kind": "subgraph",
        "icon": "",
        "label": "Subgraph",
        "x": 120,
        "y": 100,
        "width": 520,
        "height": 320,
        "locked":false,
        "parent": null,
        "dag_rank": null,
        "tags": [],
        "metadata": {},
        "z_index": -1,
        "style": "box",
        "collapsed": false
      }
    },
    "edges": {
      "e1": {
        "source": "n1",
        "target": "n2",
        "label": "flow",
        "style": "solid",
        "arrowType": "default",
        "label_offset_t": 0.5,
        "color": null,
        "thickness": 1.5,
        "directed": true,
        "bend_points": [],
        "tags": [],
        "metadata": {},
        "font_size": null
      }
    }
  },
  "editor_state": {
    "camera_x": 0,
    "camera_y": 0,
    "zoom": 1,
    "grid_size": 20,
    "snap_to_grid": true,
    "selected_items": [],
    "editing_edge_id": null,
    "theme": "system",
    "show_grid": true,
    "minimap_visible": true
  }
}
