{
  "version": 2,
  "revision": 0,
  "document": {
    "nodes": {},
    "edges": {}
  },
  "editor_state": {
    "camera_x": 0.0,
    "camera_y": 0.0,
    "zoom": 1.0,
    "grid_size": 20.0,
    "snap_to_grid": true,
    "selected_items": [],
    "editing_edge_id": null,
    "theme": "system",
    "show_grid": true,
    "minimap_visible": false
  }
}