{
  "version": 2,
  "revision": 0,
  "document": {
    "nodes": {
      "n01": { "kind": "text", "icon": "", "label": "Text", "x": 80, "y": 80, "width": 120, "height": 28, "locked":false, "parent": null, "dag_rank": null, "tags": [], "metadata": {}, "z_index": 1000, "style": "box" },
      "n02": { "kind": "text", "icon": "", "label": "Text", "x": 250, "y": 110, "width": 120, "height": 28, "locked":false, "parent": null, "dag_rank": null, "tags": [], "metadata": {}, "z_index": 1000, "style": "box" },
      "n03": { "kind": "text", "icon": "", "label": "Text", "x": 420, "y": 140, "width": 120, "height": 28, "locked":false, "parent": null, "dag_rank": null, "tags": [], "metadata": {}, "z_index": 1000, "style": "box" },
      "n04": { "kind": "text", "icon": "", "label": "Text", "x": 590, "y": 170, "width": 120, "height": 28, "locked":false, "parent": null, "dag_rank": null, "tags": [], "metadata": {}, "z_index": 1000, "style": "box" },
      "n05": { "kind": "text", "icon": "", "label": "Text", "x": 760, "y": 200, "width": 120, "height": 28, "locked":false, "parent": null, "dag_rank": null, "tags": [], "metadata": {}, "z_index": 1000, "style": "box" },
      "n06": { "kind": "text", "icon": "", "label": "Text", "x": 930, "y": 230, "width": 120, "height": 28, "locked":false, "parent": null, "dag_rank": null, "tags": [], "metadata": {}, "z_index": 1000, "style": "box" },
      "n07": { "kind": "text", "icon": "", "label": "Text", "x": 1100, "y": 260, "width": 120, "height": 28, "locked":false, "parent": null, "dag_rank": null, "tags": [], "metadata": {}, "z_index": 1000, "style": "box" },
      "n08": { "kind": "text", "icon": "", "label": "Text", "x": 1270, "y": 290, "width": 120, "height": 28, "locked":false, "parent": null, "dag_rank": null, "tags": [], "metadata": {}, "z_index": 1000, "style": "box" },
      "n09": { "kind": "text", "icon": "", "label": "Text", "x": 1440, "y": 320, "width": 120, "height": 28, "locked":false, "parent": null, "dag_rank": null, "tags": [], "metadata": {}, "z_index": 1000, "style": "box" },
      "n10": { "kind": "text", "icon": "", "label": "Text", "x": 1610, "y": 350, "width": 120, "height": 28, "locked":false, "parent": null, "dag_rank": null, "tags": [], "metadata": {}, "z_index": 1000, "style": "box" },
      "n11": { "kind": "text", "icon": "", "label": "Text", "x": 1780, "y": 380, "width": 120, "height": 28, "locked":false, "parent": null, "dag_rank": null, "tags": [], "metadata": {}, "z_index": 1000, "style": "box" },
      "n12": { "kind": "text", "icon": "", "label": "Text", "x": 1950, "y": 410, "width": 120, "height": 28, "locked":false, "parent": null, "dag_rank": null, "tags": [], "metadata": {}, "z_index": 1000, "style": "box" }
    },
    "edges": {
      "e01": { "source": "n01", "target": "n02", "label": "", "style": "solid", "arrowType": "default", "label_offset_t": 0.5, "color": null, "thickness": 1.5, "directed": true, "bend_points": [], "tags": [], "metadata": {}, "font_size": null },
      "e02": { "source": "n02", "target": "n03", "label": "", "style": "solid", "arrowType": "default", "label_offset_t": 0.5, "color": null, "thickness": 1.5, "directed": true, "bend_points": [], "tags": [], "metadata": {}, "font_size": null },
      "e03": { "source": "n03", "target": "n04", "label": "", "style": "solid", "arrowType": "default", "label_offset_t": 0.5, "color": null, "thickness": 1.5, "directed": true, "bend_points": [], "tags": [], "metadata": {}, "font_size": null },
      "e04": { "source": "n04", "target": "n05", "label": "", "style": "solid", "arrowType": "default", "label_offset_t": 0.5, "color": null, "thickness": 1.5, "directed": true, "bend_points": [], "tags": [], "metadata": {}, "font_size": null },
      "e05": { "source": "n05", "target": "n06", "label": "", "style": "solid", "arrowType": "default", "label_offset_t": 0.5, "color": null, "thickness": 1.5, "directed": true, "bend_points": [], "tags": [], "metadata": {}, "font_size": null },
      "e06": { "source": "n06", "target": "n07", "label": "", "style": "solid", "arrowType": "default", "label_offset_t": 0.5, "color": null, "thickness": 1.5, "directed": true, "bend_points": [], "tags": [], "metadata": {}, "font_size": null },
      "e07": { "source": "n07", "target": "n08", "label": "", "style": "solid", "arrowType": "default", "label_offset_t": 0.5, "color": null, "thickness": 1.5, "directed": true, "bend_points": [], "tags": [], "metadata": {}, "font_size": null },
      "e08": { "source": "n08", "target": "n09", "label": "", "style": "solid", "arrowType": "default", "label_offset_t": 0.5, "color": null, "thickness": 1.5, "directed": true, "bend_points": [], "tags": [], "metadata": {}, "font_size": null },
      "e09": { "source": "n09", "target": "n10", "label": "", "style": "solid", "arrowType": "default", "label_offset_t": 0.5, "color": null, "thickness": 1.5, "directed": true, "bend_points": [], "tags": [], "metadata": {}, "font_size": null },
      "e10": { "source": "n10", "target": "n11", "label": "", "style": "solid", "arrowType": "default", "label_offset_t": 0.5, "color": null, "thickness": 1.5, "directed": true, "bend_points": [], "tags": [], "metadata": {}, "font_size": null },
      "e11": { "source": "n11", "target": "n12", "label": "", "style": "solid", "arrowType": "default", "label_offset_t": 0.5, "color": null, "thickness": 1.5, "directed": true, "bend_points": [], "tags": [], "metadata": {}, "font_size": null }
    }
  },
  "editor_state": {
    "camera_x": 0,
    "camera_y": 0,
    "zoom": 1,
    "grid_size": 20,
    "snap_to_grid": true,
    "selected_items": [],
    "editing_edge_id": null,
    "theme": "system",
    "show_grid": true,
    "minimap_visible": true
  }
}
