{
  "version": 2,
  "revision": 0,
  "document": {
    "nodes": {
      "frame-1": {
        "kind": "subgraph",
        "icon": "frame",
        "label": "Frame Container",
        "x": 50,
        "y": 50,
        "width": 400,
        "height": 350,
        "locked": false,
        "parent": null,
        "tags": ["container"],
        "metadata": {},
        "z_index": -1
      },
      "group-1": {
        "kind": "subgraph",
        "icon": "group",
        "label": "Inner Group",
        "x": 80,
        "y": 100,
        "width": 180,
        "height": 150,
        "locked": false,
        "parent": "frame-1",
        "tags": ["container", "nested"],
        "metadata": {},
        "z_index": 0
      },
      "shape-1": {
        "kind": "node",
        "icon": "square",
        "label": "Shape 1",
        "x": 100,
        "y": 130,
        "width": 80,
        "height": 60,
        "locked": false,
        "parent": "group-1",
        "tags": [],
        "metadata": {},
        "z_index": 1
      },
      "shape-2": {
        "kind": "node",
        "icon": "square",
        "label": "Shape 2",
        "x": 280,
        "y": 130,
        "width": 80,
        "height": 60,
        "locked": false,
        "parent": "group-1",
        "tags": [],
        "metadata": {},
        "z_index": 1
      },
      "shape-3": {
        "kind": "node",
        "icon": "square",
        "label": "Shape 3",
        "x": 180,
        "y": 300,
        "width": 80,
        "height": 60,
        "locked": false,
        "parent": "group-1",
        "tags": [],
        "metadata": {},
        "z_index": 1
      },
      "external-1": {
        "kind": "node",
        "icon": "square",
        "label": "External Node",
        "x": 500,
        "y": 200,
        "width": 80,
        "height": 60,
        "locked": false,
        "parent": null,
        "tags": [],
        "metadata": {},
        "z_index": 0
      }
    },
    "edges": {
      "edge-crossing": {
        "source": "shape-3",
        "target": "external-1",
        "label": "",
        "style": "solid",
        "arrowType": "default",
        "label_offset_t": 0.5,
        "thickness": 1.5,
        "directed": true,
        "bend_points": [],
        "tags": [],
        "metadata": {}
      }
    }
  },
  "editor_state": {
    "camera_x": 0,
    "camera_y": 0,
    "zoom": 1.0,
    "grid_size": 20,
    "snap_to_grid": true,
    "selected_items": [],
    "editing_edge_id": null,
    "theme": "light",
    "show_grid": true,
    "minimap_visible": true
  }
}
