{
  "version": 2,
  "revision": 0,
  "document": {
    "nodes": {
      "node-0": {
        "kind": "node",
        "icon": "",
        "label": "Node 0",
        "x": 0,
        "y": 0,
        "width": 100,
        "height": 50,
        "locked": false,
        "parent": null,
        "tags": [],
        "metadata": {},
        "z_index": 0
      },
      "node-1": {
        "kind": "node",
        "icon": "",
        "label": "Node 1",
        "x": 120,
        "y": 0,
        "width": 100,
        "height": 50,
        "locked": false,
        "parent": null,
        "tags": [],
        "metadata": {},
        "z_index": 1
      },
      "node-2": {
        "kind": "node",
        "icon": "",
        "label": "Node 2",
        "x": 240,
        "y": 0,
        "width": 100,
        "height": 50,
        "locked": false,
        "parent": null,
        "tags": [],
        "metadata": {},
        "z_index": 2
      },
      "node-3": {
        "kind": "node",
        "icon": "",
        "label": "Node 3",
        "x": 0,
        "y": 80,
        "width": 100,
        "height": 50,
        "locked": false,
        "parent": null,
        "tags": [],
        "metadata": {},
        "z_index": 3
      },
      "node-4": {
        "kind": "node",
        "icon": "",
        "label": "Node 5",
        "x": 120,
        "y": 80,
        "width": 100,
        "height": 50,
        "locked": false,
        "parent": null,
        "tags": [],
        "metadata": {},
        "z_index": 4
      },
      "node-5": {
        "kind": "node",
        "icon": "",
        "label": "Node 5",
        "x": 240,
        "y": 80,
        "width": 100,
        "height": 50,
        "locked": false,
        "parent": null,
        "tags": [],
        "metadata": {},
        "z_index": 5
      },
      "node-6": {
        "kind": "node",
        "icon": "",
        "label": "Node 6",
        "x": 0,
        "y": 160,
        "width": 100,
        "height": 50,
        "locked": false,
        "parent": null,
        "tags": [],
        "metadata": {},
        "z_index": 6
      },
      "node-7": {
        "kind": "node",
        "icon": "",
        "label": "Node 7",
        "x": 120,
        "y": 160,
        "width": 100,
        "height": 50,
        "locked": false,
        "parent": null,
        "tags": [],
        "metadata": {},
        "z_index": 7
      },
      "node-8": {
        "kind": "node",
        "icon": "",
        "label": "Node 8",
        "x": 240,
        "y": 160,
        "width": 100,
        "height": 50,
        "locked": false,
        "parent": null,
        "tags": [],
        "metadata": {},
        "z_index": 8
      },
      "node-9": {
        "kind": "node",
        "icon": "",
        "label": "Node 9",
        "x": 0,
        "y": 240,
        "width": 100,
        "height": 50,
        "locked": false,
        "parent": null,
        "tags": [],
        "metadata": {},
        "z_index": 9
      }
    },
    "edges": {
      "edge-0": {
        "source": "node-0",
        "target": "node-1",
        "label": "",
        "style": "solid",
        "arrowType": "default",
        "label_offset_t": 0.5,
        "thickness": 1.5,
        "directed": true,
        "bend_points": [],
        "tags": [],
        "metadata": {}
      },
      "edge-1": {
        "source": "node-1",
        "target": "node-2",
        "label": "",
        "style": "solid",
        "arrowType": "default",
        "label_offset_t": 0.5,
        "thickness": 1.5,
        "directed": true,
        "bend_points": [],
        "tags": [],
        "metadata": {}
      },
      "edge-2": {
        "source": "node-3",
        "target": "node-4",
        "label": "",
        "style": "solid",
        "arrowType": "default",
        "label_offset_t": 0.5,
        "thickness": 1.5,
        "directed": true,
        "bend_points": [],
        "tags": [],
        "metadata": {}
      }
    }
  },
  "editor_state": {
    "camera_x": 0,
    "camera_y": 0,
    "zoom": 1.0,
    "grid_size": 20.0,
    "snap_to_grid": true,
    "selected_items": [],
    "editing_edge_id": null,
    "theme": "light",
    "show_grid": true,
    "minimap_visible": false
  }
}
